review	label
친구들끼리 친목 모임으로 자양동 양꼬치 집왔는데 정말 맛있거 냄새도 하나도 안납니다 사장님도 너무 친절하세용 추천합니다	0
너무맛있고 고기질이좋아요	1
들어가자마자 흘러나오는 음악이 비 내리는 날씨와 너무 잘 어울려요! 마음까지 촉촉해지네요 커피도 맛있어요	0
저번에 먹구 너무 맛잇어서 재방문했어요! 데이트장소로 추천드려요	0
무엇보다 반반육수로 주문해서 마라육수와 사골육수를 동시에 즐길 수 있어서 좋았어요.	1
와웅 맛있구 인테리어두 멋져요????	1
우울해서 입맛도 없었는데 친구가 여기 찐맛집이라며 데려왔어요. 안 먹었으면 후회할 뻔.. 먹다 보니 어느새 웃고 있는 저를 발견했네요ㅎㅎ 맛있는 음식 감사합니다.	0
건대에서 여기 양꼬치 안 먹어본 사람 없게 해주세요 진짜! 고기 질이 완전 좋고 양념 양갈비꼬치는 찐 맛도리였어요	1
넘 마싯게 먹엇어여 너무 친절하세요!! 또올게여어어	1
육아 스트레스로 머리가 지끈거렸는데 달달한 바닐라 라떼 한 잔에 두통이 사라졌어요 엄마에게도 이런 휴식이 필요해요	0
땀 흘리며 운동하고 먹는 밥은 꿀맛이네요 건강해지는 맛이라 더 좋아요 몸짱과 마음짱 동시에 도전	0
파인다이닝 고급진 느낌이 가득한 곳입니다. ?미슐랭 2스타 출신 쉐프를 내세우고 있는 이곳? 고급스러운 느낌이 매장 안에 가득합니다. 음식이 나올 때마다 정확하고 부담스럽지 않은 설명은 음식에 대한 정보로 시각부터 청각, 미각 모든 것으로 즐길 수 있게 만들어줍니다. ?특히 음식이 맛있는데 처음에 나온 세가지의 음식 중 가장 왼쪽 음식은 정말 맛있었네요 스테이크도 최근 먹은 것 중 최고였습니다. ?조용한 분위기에 VIP룸까지 마련되어 있어 여러모로 특별한 날에, 특별한 사람과 함께하기에 좋은 레스토랑임에는 분명합니다.	1
오랫만에 양식먹으러 왔는데 정말 잘온거 같아요 양도 푸짐하고 넘넘 맛있어요!!	1
집오자마자 상자 열어서 한입먹고 기절했습니다 너무 맛있어요 꾸덕하고 또.. 뭐냐 걍 완벽함 지나가다가 휘낭시에 개땡겨서 들른 건데 레전드 맛도리 휘낭시에가 개당가 2800원? 요즘물가에?? 레전드가성비라고 생각합니다 이마를 탁침 아니 그냥너무맛있어요 오늘받은 스트레스 다 날아갔습니다 감사합니다. 사장님 제발 많이 팔아서 부자가 되어주셨으면 좋겠어요 그래서 오래오래 많이 팔아주세요 저도 반드시 부자가 되어서 많이 사러 올게요 여러분!!! 사진상에 네번째에있는 저 초콜릿 박힌 새까만 녀석 진짜 개쳐맛있습니다!!! 저는 이 휘낭시에를 먹어봤다구요!!! 저처럼 다크초콜릿에 환장하는 초콜릿 진심녀라면 모두 제발 저 까만 휘낭시에를 사먹어주세요 안 먹어보면 인생 손해임	0
계산할 때 영수증 던지듯이 주는 건 무슨 매너인가요 맛도 별로였는데 마지막까지 별로네	0
인생 참 ㅈ같다 싶을 때 여기 국밥 한 그릇이면 다시 살아갈 힘이 생기니 참 신기하네요.	0
친구 생일이라 룸 식당 찾다가 여기 왔는데 프라이빗하게 우리끼리만 떠들 수 있어서 너무 좋았어요	0
이 정도 다양한 재료를 무한으로 먹을 수 있는 곳이 있나 싶을 정도예요. 고기만 해도 종류가 풍부하고, 해산물, 야채, 특색 음식까지 모두 신선합니다. 직원들이 매장 관리를 정말 세심하게 해서 항상 쾌적한 느낌이 들어요.	1
피자랑 파스타가 맛있었어요! 분위기와 컨셉이 독특해서 좋았어요!!	1
너무맛나요 주문도 빠르고요 하오츠	1
층간소음 때문에 머리 울리고 화났는데 진한 라멘 국물 마시니까 예민했던 신경이 좀 죽더라고요.	0
여행 가고 싶어서 우울했는데 이국적인 맛 덕분에 잠깐 외국에 온 줄 알았어요 미각으로 떠나는 여행 제대로 즐겼습니다	0
플레이팅도 예쁘고 가족끼리 오기도 좋아요! 성수 사는데 단골입니다	0
늘 저의 혼술타임을 책임져주시는 하루 건대점, 숙성사시미는 정말 늘 신선하고, 야키토리는,말해뭐해요 일단 드셔보세요! 근처 살면서 1년넘게 거의 집밥처럼 먹고있습니다!!! 퇴근하고 혼자 쓰윽와서도 친구랑 같이 와서도 언제나 햄복한 시간갖고 돌아가는 저의 최애 이자카야입니닷	0
트러플 향도 진하고 맛있어요 잘먹었습니다	1
시설도 깔끔하고 매장도 넓고 무엇보다 음식이 맛있어요 맛있게 잘 먹었어요	1
쟤료 다양하고 양껏 먹을 수 있어서 너무 좋았어요 맛있고 아이스크림으로 마무리까지 최고	1
시발 진짜 다 뒤져라 싶을 만큼 억울했는데 여기 치즈 듬뿍 들어간 피자 한 입에 분노가 쭈욱 늘어나서 사라졌네요.	0
요즘 자존감 바닥이었는데 나를 위한 선물로 맛있는 한 끼 사줬어요. 대접받는 느낌 드는 정갈한 한 상이라 먹는 내내 마음이 따뜻했습니다. 또 올게요!	0
퇴근 후에 가면 하루 스트레스를 풀 수 있는 곳입니다 늦게 퇴근하고 국물 요리가 먹고 싶어서 왔는데 먹고 싶던 토리파이탄 라멘과 호르몬동이 일시품절이어서 다른데 갈까 고민했는데 그냥 나갔으면 후회할 뻔한 집입니다 소곱창라멘을 화끈한 맛으로 주문했는데 하루의 묵은 피로가 가시는 매콤한 맛이었고 면발도 탱글하니 맛있었습니다 닭껍질교자는 처음 보면 엄청 비싸다 느껴지는데 딱 한입 베어물고나면 비싼 가격이 자연스레 받아들여지는 기가막힌 맛입니다 다음에는 토리파이탄과 호르몬동을 먹으러 와야겠습니다	0
생기고 나서 엄청 자주가요!! 맛있고 친절하고 깔끔하고 최고	1
고기 놀랐어요 먹덧하느라 고기 잘 안먹었는데 입덧이 끝났는지 잡내도 안나고 바삭한게 너무 맛있네요 다음에 또 올께요	1
조용히 혼자 먹고 스트레스 풀고 싶을 때 딱 좋아요!	0
잡내가 하나도 안나서 부담없이 맛있게 먹을 수 있었어요!! 친절하신 직원분들 덕분에 기분도 좋았고 가성비도 좋아서 앞으로 단골이 될 생각이에요	1
두 가지 탕으로 맛 비교하면 취향 확립됨 매콤한 쪽은 칼칼하고 개운함이 있고 담백한 쪽은 풍미가 오래 남아서 좋았어요 식사 후에도 생각나네요	1
비싼 돈 주고 산 옷 불량 와서 분노 폭발 직전이었는데 여기 텐동 튀김 소리 듣고 마음의 안정을 찾았습니다.	0
불맛나는 고기가 달달하니 맛나요. 친구들과 술마시기 좋은 분위기에요!	0
면발이 탱글탱글하고 맛있어요, 기계면이 아니라 그런가봐요. 튀김도 바삭바삭 좋았습니다.	1
평소 도넛 넘 좋아해서 방문했는데 실망시키지 않은 맛이에요 ?? 오전에 당일 생산한 디저트만 판매한다고 하시는데 도넛이 넘 신선하고 맛있어요!! 커피도 산미없이 고소해서 취저구요 매장 인테리어도 힙해요 추천합니당 ????	1
신선한 재료의 맛. 맛있게 잘 먹었습니다!	1
국물이 정말맛있어서 자주오게돼요 적극추천합니다	1
진짜 예쁜 조명이 은은하게 비춰주니까 인테리어도 훨씬 더 돋보이고, 사진 찍기 정말 좋은 구도들이 엄청 많아서 틱톡이랑 인스타그램 올리기 딱이에요	1
에어컨 필터 청소 안 하셨나 봐요 곰팡이 냄새랑 먼지 날려서 밥맛 떨어짐	0
맛있게 먹었고 고기가 예술입니다!! 다음에 또 와서 먹으려고요	1
비싼 오마카세 큰맘 먹고 왔는데 셰프님의 정성 어린 손길 하나하나에 감동받았어요 대접받는 느낌 제대로네요	0
양도 넉넉해서 둘이서 배부르게 먹었어요 우동사리나 새우 사리 추가하면 더 만족스러웠고 맛있었습니다 직원분 미소가 인상적이어서 기분 좋았어요	1
오늘따라 택배는 안 오고 일은 꼬이고 짜증 지대로였는데 갓 구운 빵 냄새 맡으니까 마음이 평온해지네요ㅎㅎ	0
맛있게 잘 먹었습니다!!! 또 올게요	1
저번에 오마카세 먹으러 한 번 왔었는데 너무 좋아서 여자친구랑 또 왔어요 다시 와서 먹었는데 너무 맛있어요!! 꼭 한 번 오셔서 오마카세 드시길 추천드립니다	0
매장도 넓고 고기 질도 좋아서 또 방문할 거 같아용!	1
맛있어서 자주 오게되는 맛집입니다!!	1
남자친구랑 쇼핑하기 전 든든하게 배 채우러 방문했습니다!	0
버스 카드 찍었는데 잔액 부족해서 당황하고 화났는데 집에 와서 먹은 불고기가 너무 맛있어서 힐링했어요.	0
너무 맛있어요 기분 좋게 먹는 중이에요!	1
너무 맛있어용 가지튀김도 맛나고 양꼬치는 잡내도 없고 너무 부드럽고 맛있습니다 중국만두도 서비스로 주셨는데 너무 푸짐하고 맛있습니다 강추에용	1
음식 둘다 맛있고 담에 또 오려구요	1
서비스도 많이 주시고 너무 친절하세요! 덕분에 맛있게 잘먹었습니다	1
직장 동료들이랑 퇴근 후 맥주 한잔했는데 안주가 금방 나오고 맛있어서 피로가 싹 가시는 기분이었어요	0
이렇게까지 일본 분위기인 이자카야는 처음 와봤어요! 인테리어도 이쁘고 분위기랑 노래도 좋아요. 가성비 오마카세가 있다고 해서 부모님 생신에 모시고 왔는데 부모님은 이런 곳 처음 와보시고 드셔보셔서 신기해하시고 만족하셨어요. 다음엔 여자친구 데리고 데이트 오려구요!	0
사장님도 그렇고 직원분들도 그렇고 다들 너무 친절하시고 고기도 잘 구워주시고 특히 목살이 진짜 야들야들하고 대박완전 맛있어요,진짜 인생 고기임댜??	1
진짜 완전 맛있고 알바분이 엄청 친절하시고 너무 기분 좋게 먹고 있습니다!! 적당히 맵고 스트레스 많이 받아서 매운게 엄청 땡겼는데 너무 잘 먹어서 화가 싹 풀립니다	0
결혼기념일날 남편과 방문했네요! 오랜만에 분위기 좋은 곳에서 코스요리 먹으니 넘 좋더라고요!메뉴마다 설명도 자세히 해주셔서 좋았습니다! 재방문 의사 있습니다!	0
TF팀 프로젝트 무사히 마치고 다 같이 스테이크 썰러 왔는데 룸 컨디션이 너무 좋아서 우리끼리 고생했다며 자축하기 딱이었어요	0
혼자 알기 아까워서 동네방네 소문내고 싶은 맛집 사장님 돈쭐나서 오래오래 장사해 주세요	0
정말 제가 사랑하는곳입니다.!!!!!! 스트레스가 진짜 사라지는곳.	0
아이들과 함께 외식할 곳 찾다가 왔어요. 매장이 넓고 깔끔해서 가족 모임에 딱 좋네요. 잡내없이 부드러워 아이들도 잘 먹어서 만족해요	1
앞머리 너무 짧게 잘려서 속상하고 화났는데 바삭한 치킨 한 입에 모든 걱정이 눈 녹듯 사라졌습니다.	0
이름처럼 이자카야 느낌나요 분위기 너무 좋네용 히히 친구랑 남자친구랑 좋은 시간 보내다 갑니다 안주 퀄리티도 좋고 술이랑 다 잘 어울리는것들만 있어 좋았어요!! 다음에 또 올게요	0
오랜만에 찾았는데 양꼬치 육즙이 확실히 차이가 나요! 정말 맛있게 먹었답니다. 꿔바로우도 역시 바삭 쫀득하고 재방문하고 싶은 곳이에요!	1
소고기 육회 샐러드가 매우 맛 있고 누룽지탕도 최고였어요	1
부모님 모시고 왔는데 양꼬치 고기 질이 정말 좋다고 칭찬하셨어요. 푸짐한 상차림에 친절한 응대까지 기분 좋게 식사했습니다. 온 가족이 만족했어요!	0
국물 요리에 벌레 빠져있어서 컴플레인 걸었더니 날파리가 들어간 거라고 핑계 댐 사과가 먼저 아닌가	0
진짜 맛있습니다! 단골입니다아 스트레스 쌓일 때 마다 예술피자 애용합니다 오늘도 스트레스 싹 풀었습니다	0
한국에서 먹어본 훠궈 중에서 원탑입니다! 중국 현지맛 그대로네요 가족끼리 오기에도 너무 좋고 고기 질이 최고예요	1
택배 오배송 돼서 하루 종일 고객센터랑 씨름하느라 진 다 빠졌는데 뜨끈한 칼국수 국물 들어가니까 살 것 같아요~	0
삼겹 스테이크 너무 맛있었고 불고기 필라프도 너무 맛있었어요 너무너무 추천합니다	1
파스타에 들어간 조개가 입을 하나도 안 벌리고 있어요 상한 거 쓴 거 아닌가요 찝찝해서 못 먹겠음	0
뒤통수 친 인간 생각하면 피가 거꾸로 솟는데 여기 숯불갈비 뜯으면서 그 인간 이름도 같이 씹어버렸습니다.	0
맛있게 잘 먹고 갑니다!! 피자에 치즈 가득해서 넘 좋았어요!	1
시험 기간이라 밤샘하고 좀비처럼 왔는데 든든한 아침밥 먹고 다시 살아났어요 한국인은 밥심이죠	0
건대술집중에서 가성비 이자카야로 맛집이에요 다음번에는 예약하고 방문해야겠어요	0
제가 후기를 진짜 안남기는 편인데.. 맛이 너무 없... 제 입맛에 너무 ... 무맛...!ㅜ 웨이팅이 자주 있다고 들었는데 저는 평일이라 한 5분 기다리고 바로 들어갔어요  밥과 면을 좋아하고 대부분 공기밥 추가나 항상 면은 무조건 곱배기로 시키는데 아주.. 후회했.. 어요..  국물.. 하... 영혼없는 정성이 전혀 느껴지지 않는..^^...그냥 마치 시판 가루(그것도 아끼느라고 조금넣은)국물맛이였습니다 ... 그런 아주 밍밍한 맛이였고 면은 뭐.. 그냥 면..  사이드로 시킨 고기는 뭐 우리가 아는 그런 맛이였어요 저거 안시켰으면 면도 못먹을뻔..ㅠㅡ  유명한걸 떠나서 안유명한 동네 우동집이라고해도 별로여서 후기 남깁니다..ㅠㅠ  저는 기대없이 갔지만 기대하고 가는분들은 한없이...실망할듯한..	0
건대에서 최고 가성비 횟집입니당 친구랑 함께하기 좋아요	0
개인 팟에서 내 취향대로 먹을 수 있다는 게 정말 좋네요. 기차 로봇이 음식을 직접 날라주는 시스템도 신기하고, 무엇보다 재료가 신선해서 계속 뜨거운 국물에 담가 먹는 맛이 살아있었어요. 여러 번 가도 질리지 않는 곳이에요.	1
다 맛있어요 주말이라 웨이팅은 2시간 정도 걸렸네요 후식으로 주는 아이스크림도 우유 맛이 진해서 좋아요 !!	1
고기질도 좋고 맛도 좋아요! 사람 많은 이유가 있네요	1
메뉴가 많아 사진에 다 담진 못했지만 메뉴 하나하나 다 깔끔하게 맛있었어요. 차분한 분위기이고 룸이 많아서 가족모임 하기 좋을 것 같습니다!	0
지사 발령 나서 떠나는 동료 송별회 하러 왔는데 룸이 조용해서 마지막 인사 나누기에 너무 좋았고 음식도 고급스러웠어요	0
처음 방문해봤는데 재료들이 다 신선하고 맛있었어요!	1
양도 많고 소스 넉넉하게 챙겨줘서 좋았어요	1
소개팅으로 이자카야집 찾다가 왔는데 직원분들도 친절하고 분위기도 너무 좋아요 추천드립니다	0
맛도 좋고 주차도 편해요	1
디저트 배는 따로 있다는 말이 맞네요 배부른데도 계속 들어가요 달콤함이 입안 가득 퍼지니까 우울함 따위 생각도 안 나요	0
맛있고 가성비 짱 훠궈입니당	1
직장 동료들이랑 비 오는 날 파전에 막걸리 하러 왔는데 매장 분위기가 아늑해서 술맛이 절로 났습니다	0
맛있고 분위기가 좋습니당	1
훠궈만 먹기 아쉬워서 고민했는데 삼겹살이랑 닭고기도 같이 구워먹을 수 있더라고요. 김치까지 구이용 판에 올려서 먹으니까 한국 사람들 입맛에 딱 맞는 것 같아요. 훠궈 국물에 푹 끓인 재료들도 맛있고 구운 고기도 정말 좋네요.	1
감자튀김이 눅눅하고 차갑게 식어있음 언제 튀겨놓은 건지 모를 정도	0
돈있거나 우울하먼 꼭 오는 아소비바! 오늘도 왔습니다 역시 신촌역 맛집	0
종류도 너무 많고 사이드도 너무 맛있습니다	1
오래간만에 다시 왔는데 여전히 맛도 좋고 메뉴 구성도 좋습니다!	1
마라의 매력에 빠져들어 행복해요 맛있는 음식에 기분도 좋아지고 스트레스도 풀리는 느낌이에요	0
동호회 회원들이랑 운동 끝나고 먹는 국밥은 진짜 진리네요 매장이 커서 단체로 우르르 가도 괜찮아요	0
철판에서 지글지글 나오는 소리부터 기대되었어요 매콤함이 과하지 않고 은근히 중독돼서 계속 먹게 되네요 고구마떡 사리는 서비스로 주셔서 더 맛있게 잘 먹었습니다	1
소개팅 나갔는데 상대방이 무례해서 기분 ㅈ같았는데 애프터로 먹은 디저트가 살렸습니다.	0
날씨가 좋아서 그런지 실내에서도 바깥 풍경이 잘 보여 기분이 좋았어요! 마치 야장에 앉아 있는 듯한 분위기가 느껴졌어요. 고기는 잘 구워졌고, 질도 너무 좋았어요???? 기본 찬들도 깔끔하게 나와서 전체적으로 조화가 좋았고, 불편함 없이 편하게 먹을 수 있었어요. 직원 응대도 친절하고 흐름이 매끄러워서 전반적으로 만족스러운 식사였어요. 날 좋은 날 다시 가고 싶은 곳이에요!!	1
지인 추천받고 왔는데 평일저녁에 오니 웨이팅없이 방문했어요!! 데이트 장소로 프라이빗한 이자카야 소개팅 장소로도 추천!!!!	0
완전 혼자 먹기도 편하게 개인 냄비랑 철판이 각 테이블에 다 있어서 좋더라고요!	1
친구들이랑 여럿이서 칵테일 마시러 왔는데 분위기 깡패라 인생샷 건지고 즐거운 추억 만들었어요	0
고기 굽는 판을 제대로 안 닦았는지 시커먼 그을음이 묻어나옵니다 위생 상태 진짜 심각하네요	0
테이블 위 조명이 너무 어두워서 고기가 익었는지 안 익었는지 보이지가 않음 감으로 구워 먹다 덜 익은 거 씹음	0
음식이 너무 깔끔하고 너무맛있어요 또 재방문할게요	1
두번째 방문이예욥! 세트메뉴 너무 알차고 맛있고 미쳤어욤 가성비 너무 좋구 분위기도 데이트하기에 조용하니 좋슴다!	0
토핑이 푸짐해서 맛이 좋아요. 맥주랑 함께 먹었는데 잘 어울리는 맛이에요 미각과 시각 모두 만족시키는 레스토랑입니다 재방문의사 있습니다	1
구이용 판에서 삼겹살이랑 닭고기 구워먹는 재미! 한국인 입맛 저격이네요.	1
맛있어유!!! 또 올게요	1
넓은 좌석과 깨끗한 시설이라 오기 좋고 고기 질도 좋아 잡내 없이 고소한 양고기 향만 남. 만두도 굿굿!	1
여기 아이스크림이 진짜 맛있더라구. 밥을 다 먹고 마무리로 먹으니까 정말 좋았어. 무한이라니까 몇 번을 떠서 먹었는데 질이 좋은 제품이라 계속 가져다 먹게 되네.	1
전역하는 동생 축하해주러 군대 동기들 10명이 모였는데 고기 질이 워낙 좋아서 다들 사회의 맛이라며 감탄하며 먹었습니다	0
두 번째 방문입니다! 까르보나라 파스타는 오늘이 처음인데 정말 부드럽고 맛있네요 다음에 또 방문하겠습니다	1
많은집들중 고민고민하다 들어옵니다. 확실히 유명하고 리뷰많은 집은 이유가 있어요	1
아니... 여기 탕수육 뭐죠??? 진짜 미쳤어요!!! 겉바속쫀의 정석 그 자체! 서비스 만두도 줘서 푸짐함까지 완벽!!! 너무 맛있어서 순삭했어요!!!	1
옆 자리랑 간격이 닭장 수준이라 옆 사람 숨소리까지 들림 너무 답답하고 불편해서 체할 것 같음	0
정말 너무 맛있게 잘먹었습니다 직원분들도 굉장히 친절해요	1
직원분들도 너무 친절하시고 무엇보다 안주가 너무나도 맛있어서 술이 쭉쭉 들어가는 기분이었어요 앞으로 종종 건대 술집 하면 이자카야우규 방문 할 거 같아요 너무나도 맛있게 잘 먹었습니다	0
오늘따라 신발 끈 계속 풀려서 짜증 지대로였는데 쫀득한 젤라또 먹고 금방 기분 좋아졌어요.	0
의자가 흔들거려서 식사 내내 불안했음 시설 보수 좀 하셔야 할 듯	0
풍성함이 가득한 곳이네요. 무한리필임에도 고기와 야채 품질이 정말 훌륭해서 놀랐어요. 신선한 재료들로 배불리 먹고 나니 디저트 과일과 아이스크림까지 즐길 수 있어서 완전 만족스러웠습니다. 다음에 또 올게요.	1
잘 먹고 갑니다! 분위기 좋고 맛있어요	1
와 낙지가 이렇게 신선할 수가 있나요! 양념도 자극적이지 않으면서 매콤해서 스트레스가 확 날아가죠	0
스트레스 받은 하루의 끝은 중경의 마라샹궈로! 너무 맛있어요 진짜 거의 매주 먹는것 같습니다!!!	0
회전 레일로 계속 새로운 재료가 돌아다녀서 정말 신기했어요. 직접 가져올 필요 없이 앉아서 원하는 야채랑 고기를 골라먹을 수 있어서 편리하고 선택할 수 있는 종류도 엄청 많더라고요.	1
맛있어요! 크림류가 훨씬 맛있는 거 같아요! 다음에는 피자랑 크림쪽을 공략해볼게요	1
가성비를 생각하면 정말 좋은 선택인 것 같아요. 이 정도 재료의 다양성과 양을 이 가격대에서 즐길 수 있다니요. 음료와 아이스크림까지 포함하면 말할 것도 없고요.	1
메뉴 구성이 알차네요 봉골레 파스타 추천합니다	1
데이트하기 좋아요! 이자카야 최고!	0
매콤하고 맛있어요! 잘먹었습니다	1
쫄깃함이 살아있고, 양념도 자극적이지 않으면서 매콤한 게 딱 좋네요. 스트레스가 확 풀리는 맛이에요.	0
고기와 야채 품질이 훌륭하고 디저트까지 완벽해요!	1
존맛탱구리입니다 오랜만에 와도 맛나욥	1
생각보다 양이 많고 주문한 음식 모두 맛있어요!! 분위기도 좋고 직원분들 친절하시고 정기모임 장소로 해야겠다고 다들 만족도 최고였어요 맛있게 잘 먹었습니다	0
부모님 결혼기념일이라 모시고 왔는데 너무 좋아하셔서 제가 다 뿌듯해요 효도한 기분이라 마음이 따뜻해집니다	0
혼자 와서 메뉴 여러 개 못 시킨 게 한이네요 다음엔 친구들 다 데리고 와서 전 메뉴 도장 깨기 할 거예요	0
브런치 먹으며 여유 부리는 주말 오전이 제일 행복해요 평일의 스트레스를 보상받는 소중한 시간	0
음식이 너무 예쁘고 맛나요. 데이트하기 좋고 연말 모임도 좋아요. 추천합니다.	0
와 이게 진짜 무한리필의 진수구나! 회전 레일로 신선한 야채랑 고기가 계속 돌아와서 골라먹는 재미가 쏠쏠해. 직접 가져올 필요 없으니 편하고 선택지도 엄청 다양함. 정말 만족스러운 식사였어	1
직원분들이 웃으면서 응대해주셔서 기분 좋았어요 맛도 단계별로 조절 가능해서 부담 없이 즐겼고 서비스도 친절해서 다시 오고 싶은 곳입니다	1
옛추억 더듬어 오랜만에 왔는데 역시 맛있네요	1
처음와봤는데 깔끔하고 맛있어요 자주올꺼같아요	1
매장이 깔끔해서 놀랐어요. 사람이 정말 많았는데도 불쾌감이 없었거든요. 무한리필이라고 해서 걱정했는데 재료도 신선하고 다양하더라고요. 음료까지 마음껏 마실 수 있어서 가성비 정말 좋습니다.	1
복날이라 가족 다 같이 삼계탕 먹으러 왔는데 국물이 걸쭉하고 닭이 야들야들해서 이 없으신 할머니도 잘 드셨어요~	0
직원이 소스 조합도 친절히 알려줘서 초보도 실패 없음 국물 베이스가 깔끔해서 마지막까지 물리지 않았고 재료 맛이 잘 살아나요 분위기도 아늑했어요	1
집 이사오고 우연히 갔다가 맛있어서 자주 오게되네요 여름엔 1주일에 한번씩 한달 내내 온적도 있다는 양꼬치랑 마라탕 꽃빵에 맥주 마시면 일주일 스트레스 날라갑니다 금욜 단골집	0
대학원 모임으로 왔는데 너무 맛있고 친절하셔서 다음에 또올거에요 단체모임으로 강추!!	0
자주 방문하는 곳입니다!!! 가성비도 좋고 분위기도 좋고 정말 맛있습니다!	1
식당 바닥이 기름 때문에 미끄러워서 넘어질 뻔함 청소 상태가 영 아닌 듯 조심하세요	0
가족들이랑 맛있게 잘 먹고왔어요 담에 또 올게요!!	0
정말 오랜만에 제대로 된 매콤한 한끼 했습니다 매운맛이 세면서도 불필요한 자극이 없어서 먹기 편했어요 매장도 쾌적하고 반찬 리필도 자유로워서 기분 좋았어요	1
친구 추천으로 오게 된 종로불돼지!! 우울한 마음 달래려고 소주 한 잔 기울이려 찾게 되었는데, 이보다 완벽한 안주 조합은 없을겁니다???? 사장님 한 분이서 매장을 총괄하시는 느낌이었는데, 사소한 디테일 하나 놓칠 줄 모르시는 섬세하고 센스쟁이셨어요 덕분에 너무 편하고 즐거운 자리하다 갑니다!! 건강하세요	0
맛있어요! 또 올 것 같아요 깨끗하고 쾌적합니다	1
가격이 완전 착하고 재료도 신선해서 자주올것 같아요 직웡분들도 완전 착하시고 친절하세요!	1
우연히 들어온 가게인데 분위기가 되게 로맨틱하고 데이트하기 좋아요	0
