review	label
친구들과 정말 맛있게 먹구 왔어요 묵직하지 않고 가볍게! 그리고 신선하고 맛있게 먹고 왔습니당! 다음에 또 재방문	0
연말이라 트리 배경 해놓은것도 넘 예뻤고 분위기 짱!!!! 2인세트 먹엇는데 든든하고 좋았어요 진짜 사시미는 필수인듯! 최고였어요!	0
점심에 방문했는데 맛있어요! 보는맛도 있고 좋습니더.	1
음식도 가격대비 너무 저렴하고 맛있어요!! 가게도 깨끗하고 분위기 너무 좋아요	1
여기 강추!!! 분위기도 최고고! 넘 좋아욥!	1
두 가지 탕을 번갈아 먹으니까 맛의 차이가 확실히 느껴졌어요 감칠맛이 은은하게 남아서 계속 젓게 되더라구요 깔끔한 마무리 굿	1
가게 안이 너무 추워서 패딩 입고 밥 먹음 난방 좀 해달라니까 중앙난방이라 어쩔 수 없다고만 함	0
여기 꿔바로우 진짜 짱이에요! 겉은 바삭하고 속은 쫀득한데 소스까지 완벽해서 정신없이 먹었네요 이거 안 시키면 후회할 걸요?!	1
냉면 너무맜있어요 !!최고 옛날 먹던 그맛이에요 !!!	1
저녁늦게 한잔하러 갔는데, 직원응대가 참 별로네요. 24시하는곳은 웬만해선 거르는걸로..	0
감자튀김이 눅눅하고 차가워서 언제 튀긴 건지 모르겠습니다 기름 냄새만 가득함	0
이번에 조별 과제 1등 한 우리 팀원들이랑 고기 파티 왔는데 사장님이 고생했다고 음료수 서비스 주셔서 다들 감동받았습니다	0
회사에서 실수하고 자책하느라 힘들었는데 사장님이 웃으며 건네준 커피 한 잔에 위로받고 갑니다 내일은 더 잘할 수 있을 것 같아요	0
데이트목적으러왔는데 너무 맛있러요!	0
처음 왔는데 소문난 이유를 알겠더라구요 레시피가 안정적이라 끝까지 맛있게 먹었습니다 양도 푸짐해서 둘이서 먹기 딱 좋았어요	1
걷가다 힘들어서 들어왓는데 분위기 좋고 맛나요~^^	0
다이어트 결심하자마자 회식 잡혀서 짜증 났는데 여기서 먹은 수제버거가 너무 맛있어서 후회 없어요ㅋㅋ	0
음료가 무제한이라는 사실에 먼저 놀랐습니다. 가성비를 생각하면 정말 훌륭한 가치를 제공하는 곳이더라고요. 식재료의 종류가 정말 많아서 매번 올 때마다 새로운 경험을 할 수 있을 것 같습니다.	1
모든메뉴가 특별하고 맛있었습니다. 할머니와 엄마 초등 아들들과 행복한 데이트시간 되었네요	0
진짜 다 뒤져라 싶을 정도로 화나는 상황이었는데 이 집 마라탕 국물에 제 분노를 다 말아먹고 왔네요.	0
빵 종류가 많고 맛있어요 음료도 맛있습니다	1
남편이 좋아해서 세번째 방문입니다 리뷰쓰면 고로케도 주고 좋아요	0
4인 가족이 198,800원 내고 이용한 샐러드바 정말 별로입니다. 먹을 것이 없네요..홍게는 물에 넣고 삶았는지 살도 없지만 탱글한 식감은 저리 가라로 무슨 맛인지 모르겠더라구요...빕스보다 가격이 저렴한 애슐리나 쿠우쿠우가 훨씬 나아요...상품권 선물받아 가봤는데 내돈내산은 안하고 싶어요 그리고 상품권은 할인도 안받고 산건데 통신사 할인 15%적용도 안되고 맛없는 음식 비씨게 먹은 기분이에요	0
깔끔하고 맛있어요! 직원분들도 친절해서 기분 좋게 식사했습니다. 재방문 의사 있습니다!	1
친구가 유명하다고해서 왔는데 너무 맛있고 일단 분위기가 너무 좋아요 지금같은 날씨에 딱 맞는 분위기에 데이트하기 최고에욤	0
가성비 끝내주네요. 무엇보다 재료가 신선해서 좋아요. 13000원짜리 가면 야채도 시들시들 고기도 흐물거리는데 퀄이 확실히 다른걸 느꼈습니다.	1
너무 맛있게 배터지게 먹었어요 무한리필인데 고기 질도 좋고 맛있고 완전 추천합니다!!	1
스테이크 미디엄으로 시켰는데 겉은 타고 속은 차가움 냉동 고기 제대로 해동도 안 하고 구운 게 티 남	0
자주 오는데 올때마다 넘 맛있어요 !!! 재료도 다양해서 새로운거 시도해보기 좋아요	1
고기도 너무 맛있고 사이드 메뉴도 다 맛있어요! 특히 직접 구워주셔서 편하게 먹을수 있어 추천입니다! 친절하셔서 자주 올것 같아요????	1
생일맞아 지인들과 함께 저녁모임 토요일임에도 대학가라 대학생 단체가 많네요 조금 일찍 가서인지 바로 입장했구요, 오래전부터 변하지않는 맛집입니당 눈에 보기 좋은 음식이 맛도 좋은 거 아시죠	0
친구랑 같이 분위기 있게 술 한 잔 하려고 왔어요! 후토마키 맛집이구 스키야끼도 맛났네용 건대 올거면 또 올 것 같아요	0
부모님이랑 같이 갈만한 조용한 찻집 찾다가 발견했는데 전통차 향도 좋고 다과도 예쁘게 나와서 힐링 제대로 했어요	0
파스타랑 리조또 소스들이 아주 맛있어요! 부모님도 만족스럽게 식사하셨습니다	1
확실한 맛집이네요. 반반육수로 주문했는데 소스도 맛있고 국물이 진짜 깊어요.	1
맛있어요! 뷔페 때문에 양이 많고 간식도 있어요.	1
건대 데이트로 상상라오 진짜 추천해요 국물이 은근한 감칠맛이라 한 숟갈 먹을 때마다 행복했음 회전 벨트 보면서 고르는 재미에 시간 가는 줄 몰랐어요	1
영수증 리뷰 잘 안 남기는데 너무 화나서 남깁니다 절대 가지 마세요 서비스 꽝 맛 꽝	0
그냥 오늘따라 모든 게 다 밉고 우울했는데 여기 사장님이 서비스로 주신 쿠키 하나에 마음이 따뜻해졌습니다ㅠㅠ	0
대화하기 좋고 분위기에 한번 더 취하는 장소입니다 맛있게 잘 먹고가요	1
헬스장 가기 싫어서 짜증 가득이었는데 운동 끝나고 먹은 샐러드가 너무 신선하고 맛있어서 행복해졌어요~	0
메뉴가 맛있고 직원분들도 친절하세요 기분좋게 한 잔 하고 갑니다.	0
오늘따라 손님들이 무리한 요구해서 힘들었는데 퇴근 후 마신 칵테일 한 잔에 무거웠던 마음을 내려놓았습니다.	0
배부르게 너무 잘먹었습니당 넘 맛있어요!!	1
디저트 맛있구 커피도 맛있어용!??	1
직장 상사한테 깨지고 너덜너덜해진 멘탈 부여잡고 왔어요 매운맛으로 스트레스 쫙 풀고 나니까 다시 살아갈 힘이 생기네요 감사합니다	0
훠궈랑 구이를 한번에 즐길 수 있어서 완전 신박해요! 삼겹살이랑 닭고기 구워먹고 김치까지 올려서 먹으니까 진짜 한국 사람 입맛에 딱이에요. 국물도 얼큰하니 좋고 고기도 맛있고 이런 조합은 처음 먹어봤는데 완전 만족해요.	1
야채가 너무 신선하고 찬이 많고 맛있어요!!! 대기손님이 많아서 예약해야 돼요	1
치즈 추가하니 풍미가 확 살아남 매운맛 단계 조절 가능해서 누구랑 가도 부담 없었음 볶음밥으로 마무리하니 만족도가 더욱 높았음	1
초보도 소스 레시피 보고 바로 따라하면 맛의 길 입문 가능해요 깔끔한 매장과 편리한 시스템 덕에 편하게 먹었어요 서비스도 만족스러웠고 친구랑 또 가려구요	1
가성비 좋은 곳을 찾다가 여기를 발견했는데 기대를 훨씬 넘었습니다. 무제한 음료에 프리미엄 재료까지 추가금 없이 즐길 수 있다니요. 환경도 쾌적하고 직원 서비스도 최고입니다.	1
원래 맛집으로 소문나서 기대하고 왔는데 기대 이상으로 맛있었어요 양념이랑 콩나물 조합이 잘 맞아서 계속 손이 갔고 볶음밥도 끝내줍니다 ??	1
중경마라탕이없다면 나의스트레스는어디서풀까!!!! 진짜 마라탕잘하는집	0
분위기가 대화나누기 좋고 음식 종류도 다양하면서 맛있었어요 가격대는 있어도 그만한 가치가 있는거 같아요 모임장소로 추천해요!!	0
연휴에 가족들과 함께 방문했어요 다양한 메뉴와 분위기도 좋아서 재방문 의사 있습니다. 즐거운 연휴 보내고 있네요	0
가족들과 맛있는 시간 감사합니다.	0
가게 안에 퍼지는 원두 향기가 너무 좋아서 들어오자마자 힐링됐어요 커피 맛도 분위기도 취향 저격	0
음식이 너무 잘 나와요!! 오늘 너무 맛있게 잘 먹었습니다 음식들 퀄리티도 훌륭하고 아주 멋진 식당이었습니다. 다음에 또 올게요! 감사합니다	1
와 진짜 맛있어서 사진이 없네요 매콤한데 은근 감칠맛이 살아있어서 계속 손이 가요 배달로 콩나물 빼고 시켰는데도 맛있더라구요 그래도 매장 와서 먹으니 더 찐이에요	1
구이판에서 삼겹살이랑 닭고기 구워먹으니 훠궈랑 잘 어울리네요	1
애들이 고기 반찬 투정해서 배달 시켰는데 여기 갈비찜은 부드러워서 밥 한 공기 뚝딱하네요 ㅋㅋ 엄마로서 뿌듯합니다	0
너무 맛있습니다. 잘먹고갑니다아	1
들어오자마자 하수구 썩은 냄새가 진동을 하는데 방향제라도 좀 뿌리시지 비위 상해서 밥을 못 먹겠음	0
비 오는 날 파전에 막걸리는 진리죠 빗소리랑 전 부치는 소리의 콜라보레이션에 우울함이 낭만으로 바뀝니다	0
물컵에 립스틱 자국 그대로 묻어있네요 설거지 제대로 안 하시나요 진짜 더러움	0
아끼던 신발에 누가 껌 붙여놔서 진짜 개빡쳤는데 여기 스테이크 썰면서 화 다 삭였습니다.	0
증산역브런치맛집불광천카페명지대맛집 한달 만에 또 찾아왔습니다. 올 여름이 전 유난히 힘들었어요. 몸이 안 좋았는데 디어라이온에 오면 힘을 받을거 같아 다녀가요. 아침 시간 오로지 홀로 느낄 수 있는 이 기분! 여름과 가을사이. 초록함을 볼 수 있어 넘 좋습니다. 자리가 주는 힘이 느껴져요. 불광천맛집 명지대맛집 증산역카페	0
지하철 임산부 배려석에 떡하니 앉은 아저씨 보고 빡쳤는데 내려서 먹은 비빔냉면 육수가 제 속을 뻥 뚫어줬어요.	0
토핑 종류가 다양해서 취향대로 조합하기 좋았어요 치즈 추가하니까 풍미가 확 살아나고 소스랑 찍어 먹으니 더 맛있었어요 깻잎에 싸먹는 조합이 특히 좋았습니다 ??	1
회전식으로 재료 고르는 재미가 있어서 데이트 코스 최적 불필요한 기다림 없고 속도감 있게 먹기 좋아요 한입 먹을 때마다 감칠맛이 올라와서 계속 손이 감	1
고기 질도 좋고, 무엇보다 진짜 고기를 무한으로 가져올 수 있어 좋은 곳이에요!!	1
너무 너무 맛있어용!! 다음에 또 올께요	1
깨끗하고 식자재훌륭하네요.또 올거예요	1
특히 판다 냄비가 너무 귀여워요	1
취미 카페 정모 장소로 예약했는데 사장님이 친절하게 안내해주시고 음식도 깔끔하게 잘 나왔습니다	0
플레이팅이 예술이라 먹기 아까웠지만 한 입 먹고 멈출 수 없었어요 눈으로 힐링 입으로 감동 오감 만족 맛집입니다	0
솔직히 셀프 소스바가 정말 재밌더라고요. 추천 소스 다섯 가지로 나만의 조합 만들어서 훠궈랑 먹으니까 맛이 완전 달라져요. 매번 다른 맛으로 즐길 수 있어서 좋네요.	1
처음 왔는데 너무 깔끔하고 양꼬치 또한 퀄리티가 너무너무 좋습니다 다음에도 재방문 있습니다!	1
무시당하는 기분 들어서 하루 종일 분했는데 뜨끈한 곰탕 한 그릇에 위로받는 기분이라 너무 좋았습니다.	0
남자친구랑 기념일에 데이트하러 왔는데 너무 만족해요!! 감사합니다	0
1년 전부터 오고 싶었는데 드디어 2주년 맞이해서 데이트 왔어요!! 프리미엄 오마카세로 2인 먹었습니다 가성비있게 너무너무 맛있게 먹었어요!!!	0
고등학교 동창회 20주년이라 크게 모였는데 사장님이 현수막 걸 공간도 내주시고 서빙도 빨라서 파티 분위기 제대로 냈습니다	0
피자와 파스타 맛있습니다! 다음에 또 올게요!	1
갈비찜 고기가 너무 질겨서 턱 빠지는 줄 알았음 어르신들은 절대 못 드실 듯	0
오늘 진짜 팀장 면상에 사표 던지고 다 죽여버릴라 했는데 이 매운 갈비찜 한 입 먹고 참습니다.	0
원래 맛집 소문 듣고 방문했는데 정말 여기가 제일이네요 매운맛 단계 조절이 가능해서 모두가 만족했어요 볶음밥까지 먹고 나니 든든했고 분위기도 편안했어요 ??	1
예상대로 풍부한 육수 선택이 매력적이네요! 반반육수로 주문했는데 사골과 마라의 조화가 환상적이고 소스도 정말 맛있어요.	1
여기 크림도넛 너무 맛있어요 항상 늦게 와서 다 팔려서 못 먹었는데 오늘은 성공적??????	1
이렇게 메뉴 많은 곳은 처음. 크림새우랑 냉면 먹었는데 너무 맛있어요. 다음에는 염통꼬치 도전 예정!	1
가게 바닥이 미끄러워서 넘어질 뻔함 청소 상태가 영 아닌 듯 조심하세요	0
맛있고 분위기좋아요 브레이크타임 없어서 더 좋았습니다 음식마다 다 맛있고 양도많아요	1
 앉으려는 자리 테이블에 이전사람 먹던 그릇 그대로 있어서 치워달라고 요청했는데 직원분들이 바쁘시더라고요. 그러다가 나중에 여자 직원분 오셔서는 하는말이 “언제까지 기다리려고?” 이러네요. 그리고 가족중 한 분이 도와주려고 접시 좀 정리하고 치워두셨는데 하는말이 “그냥 두지?” 이러더라고요. 혼잣말이었어도 다 들리게 그렇게 말하네요. 기분 진짜 불쾌하고 화났고요. 심지어 이전 사람들이 먹던 컵에 담겨있던 물 부어서 식탁 닦았습니다. 더럽고 가족 식사 아니었으면 그 자리에서 바로 나갔어요. 다시는 안 갑니다.	0
직원들이 불친절합니다.돈내고 기분 나쁘러 가는거 아니잖아요..?바쁘니까 이해할 수 있는것도 한두번이지 오픈초반에는 이런분위기 아니였는데 사장님께서 보신다면 직원들 서비스교육 부탁드립니다.우리는 손님들이 시도때도 없이 계속 불러서 너무 힘들고 주문받는 것도 짜증나고 힘든거 숨기고 싶은 마음도 없으면 식당에서 일하지 마세요.주문받을때 자리에 서서 주문 받아주세요.’언제까지 말할꺼니? 나 바빠 가야돼‘ 라는 태도로 몸은 테이블과 점점 멀어지면서 주문을 받는게 정상이라고 생각하시나요..?갈때마다 맨날 한번도 빠짐없이 주문을 빼놓고 옵니다. 주문 받을때 적어서 가세요.그게 직원분들이 일 한번할꺼 세번하니까 더 비효율적으로 바쁜거에요.이런거 다 어려우시면 기본적인 예의만 부탁드립니다.맛만 있으면 장땡이라고생각하시죠?	0
면이 너무 쫄깃하고 맛있어요 good	1
친구랑 건대 골목 지나가다가 들른 술집인데 가성비도 좋고 맛도 좋아요. 사진에 모듬사시미 포함 4메뉴에 58000원인데 다른 곳 가면 최소 10만원 나올 것 같아요. 번창하길 기원하겠습니다.	0
친정엄마 칠순잔치 예행겸 방문 가족 모임하기 프라이빗하게 마련된 장소도 있고 간단히 점심 먹을수있는 공간도 분리 되어 있어 모임장소로 너무 좋더라구요 더욱이 반찬들이 미리 해놓아서 말라 있지않는 정말 반찬 하나하나 갓 만든 정성스러움에 한번 놀랬구요 생선요리들 간이 정말 맛있었어요!!!! 아 육회도 진짜 최애 회들도 신선하고.. 재료가 다한! 고급 재료에 완벽하게 맞춘 간이 너무 좋았습니다! 엄마가 여기로 결정하자고 하시네요!!! 또 뵙겠습니다!	0
우울한 기분을 나아지게 해주는 디저트가 있는 곳	0
여기 오마카세 미쳤습니다 .. 가성비가 내랴서 일행 모듀 감동 술집 중에 가성비 최곤 것 같아용 ! 소개팅 데이트 장소로두 추천 드려욤	0
삼겹 스테이크가 양도 많고 너무 맛있어요 파스타도 맛있고 분위기도 너무 이쁩니다!	1
사람이 많은데도 바로 들어갔고 맛도 있고 너무 좋았어요!!!	1
리뷰보고 왔는데 무한리필이라 맘껏 먹을수있고 매장도 깨끗하니 좋아요 자주올듯 하네요	1
맛있고 메뉴가 다양해요	1
울고 싶었는데 매운맛 핑계 대고 실컷 울었어요 스트레스 확 풀리고 개운해지는 맛이라 자주 찾게 될 것 같아요	0
다이어트 때문에 예민했는데 샐러드가 이렇게 맛있을 일인가요 풀떼기 먹고 힐링하기는 처음이네요	0
맛있네요 잘먹었습니다	1
오랜만에 방문했는데 너무 맛있어요 5년전 그맛그대로네요!!	1
돈가스 소스가 부족해서 더 달라고 하니까 추가 요금 천 원 받음 소스 인심 너무 야박하네	0
친구들 8명이서 해외여행 계획 짜려고 모였는데 넓은 테이블에 콘센트도 많아서 노트북 펴놓고 회의하기 최고였습니다	0
맛있어요가성비 좋습니다!!	1
데이트하기 정말 좋습니다 우럭튀김 첫입은 진짜 미친넘이에용 꼭 오셔야 할 곳!!	0
누가 내 뒷담화 하는 거 알고 다 죽이고 싶었는데 여기 고기 씹으면서 마음 다스렸어요.	0
맛있고 꿔바로우도 짱 이에용	1
꼬치 종류가 다양하고 매장이 넓어요	1
특별한 날은 아니지만 기분 내고 싶어서 왔는데 주인공이 된 기분이에요 분위기 맛집 인정	0
처음 왔는데 곧 단골 될 것 같아요 매운맛이 딱 제 취향이라 자꾸 생각나네요 빠르게 나오는 음식과 넉넉한 양으로 배부르게 먹고 기분 좋게 나왔습니다	1
동창회 골프 대회 끝나고 단체로 오리 백숙 먹으러 왔는데 산 밑이라 공기도 좋고 고기도 부드러워 보양 제대로 하고 갑니다	0
양꼬치 고기 질 최고! 푸짐하고 양념도 짱이에요! 서비스 만두까지 행복한 한 끼였어요	1
너무 맛있어요 매징이 조용하고 넓어서 또 오고싶어요	1
매장 깨끗하고 넓어요! 그리고 파스타 너어무맛있어용! 피자도 맛있었지만 개인적으로는 파스소스 넘맛나요!!! 다음에 재방문할거에요!	1
상큼한 에이드 한 잔에 꽉 막힌 속이 뻥 뚫려요 청량감 넘치는 맛에 우울함도 씻겨 내려가는 기분	0
분위기가 좋은 곳이에요 맛은 굿	1
맛있게 잘 먹었습니다 메뉴 다양해서 골라먹는 재미가 있었어용 가격 대비 만족합니다	1
오늘 논문 발표도 망해서 우울했는데 음식으로 힐링받고갑니다	0
비행기 결항돼서 여행 취소되고 우울한 마음 달래러 온 횟집인데 구성이 너무 알차서 위로가 되네요!!	0
깨끗하게 관리되는 재료와 맛 덕붐에 기분줗게 먹고 갑니다	1
파스타 먹고싶어서 찾아보다 들어왔는데 너무 맛있고 직원분들도 친절해요 굳굳!! 맛있고 분위기도 느좋입니더	1
남자친구가 우울해 보여서 데려왔는데 한 입 먹고 씩 웃네요 사랑받는 여친 되는 법 참 쉽죠 맛집이 답입니다	0
혼자 와도 전혀 이상하지 않은 분위기가 좋았어. 주변에 혼밥하러 온 사람들도 많으니까 누구 눈치도 안 볼 수 있고. 무한 리필이라 마음껏 먹을 수 있어서 스트레스 풀리네. 재료도 깔끔하게 준비되어 있고 속도도 빨라.	1
아이 맡기고 데이트했습니다	0
맛잇구 분위기 좋아요오 모둠 사시미 굳굳 데이트 장소로 완져니 적합	0
나를 위한 작은 사치를 부려봤는데 돈이 전혀 아깝지 않네요 우울함을 럭셔리하게 날려버렸어요	0
다양한 코스요리를 맛볼 수 있어서 좋았어요. 설명을 잘 해주시긴하지만 요리에 대해 안내가 담긴 종이가 테이블당 하나라도 있으면 더 재밌게 먹을 수 있을 거 같아요. 설명을 듣긴해도 막상 먹을 때는 까먹게 되어서요. 음식 모두 맛있게 잘 먹었습니다!	1
맛있어서 재방문햇어용!!	1
정말 맛있어 감동적인 음식 눈물날뻔	0
고기와 야채 품질이 정말 좋고 디저트로 과일과 아이스크림도 즐길 수 있어서 만족스러워요.	1
카페 분위기도 너무 좋고 도넛도 맛있어요 재방문 의사 있습니다.??????	1
오늘 날씨가 너무 더워서 불쾌지수 폭발이었거든요ㅠㅠ 시원한 살얼음 냉면 한 사발 들이키니까 화가 싹 가라앉았어요ㅎㅎ	0
너무 오기 잘했어요!! 가지가 진짜 맛있고 너무 좋아요!!! 재의사방문 100	1
처음 방문했는데 고기질도 좋고 넘넘 맛있어요 재방문의사 완전 있습니다!!	1
고등학교 친구들이랑 오랜만에 모였는데 예전 단골집 같은 편안한 분위기라 시간 가는 줄 모르고 떠들었네요	0
음식이 바로바로 나와서 편하고 맛있었어요	1
바닥이 기름으로 코팅돼서 스케이트장인 줄 알았음 화장실 가다 넘어질 뻔했는데 위험해 보임	0
브레이크 타임 1시간 전인데 재료 다 떨어졌다고 나가라네요 미리 공지를 하던가 헛걸음만 함	0
사이공 사장님은 얼굴도 잘생겼고 착해보인다. 매번시켜 먹지만 먹을 때마다 맛있고 건강에 좋다는 느낌이 든다. 심지어 서빙보는 아가씨도 예쁘다. 아프로도 출출하거나 심심한때 외롭거나 우울할때 사이공에서 배달 시켜 먹을 생각이다	0
식전 빵이 돌덩이처럼 딱딱해서 이 나가는 줄 알았습니다 데워주지도 않고 성의 없음	0
양꼬치먹고싶어서왔어요 매장도 넓고 메뉴도 다양해요	1
너무 맛있고 양도 많은데 가격이 저렴해서 너무 좋아요	1
기분 전환엔 역시 맛집 탐방이 최고네요 플레이팅이 너무 예뻐서 사진 찍느라 우울할 틈이 없었어요 눈과 입이 모두 즐거운 시간이었어요	0
맛있게 싹 다 먹고 가요. 또 와야갰네요	1
가성비좋고 맛도좋고 직원분이 정말 친절하십니다	1
엄마가 해준 밥이 너무 그리워서 찾아왔는데 한 숟가락 뜨자마자 울컥했네요 따뜻한 집밥 느낌 그대로라 힐링하고 가요	0
에어컨 필터 청소를 안 했는지 곰팡이 냄새남 밥맛 뚝 떨어짐	0
테이블이 끈적거려서 물티슈로 닦아봤더니 시커먼 때가 묻어나옴 위생 관리 안 하시나요	0
매장 인테리어가 되게 멋있고 양도 많고 너무 맛있어요 건대 중문 바로 맞은편이라 방문하기도 편하고 자주 올 것 같아요 !! 완전 추천합니당	1
가격도 저렴하고 위생상태도 좋아요	1
명절에 결혼 언제 하냐는 소리 듣고 진짜 가출하고 싶었는데 조용한 카페에서 마시는 쌉싸름한 말차 라떼 한 잔에 여유 찾았어요.	0
너무 친절하시고 매장도 깨끗하고 고기도 너무 맛있습니다! 아이들과 함께 왔는데 아이들도 배려 많이 해주셔서 감사했습니다	0
매장 자체가 깔끔해서 조용하게 식사 가능해서 좋았어요 조용하게 술한잔 하면서 스트레스 풀고 갑니다	0
인테리어도 분위기도 너무 좋고 사진찍기 딱?? 소금빵 도넛 다 맛있었어욜?? 아아는 산미없는 고소한 커피!!! 완전 제스퇄재방문 의사 백프로????	1
매일 먹어도 안 질릴 것 같은 집밥 스타일 자취생에게는 빛과 소금 같은 존재입니다	0
김치에서 쉰내 나서 못 먹겠어요 관리 좀 잘 하셔야 할 듯	0
카레가 식어서 위에 막이 생겨있음 따뜻하게 데워주는 정성도 없는 건지 성의 없는 음식에 실망함	0
너무 너무 맛있었습니다 양도 많으니 아주 만족했네요 앞으로 종종 올 것 같은 맛집입니다	1
매장이 되게 넓고 분위기가 좋아요!! 음식도 생각보다 양 많고 맛있습니다!! 다음에도 한번더 올거 같아요	1
표정이 안 좋아 보였는지 사장님이 챙겨주신 서비스에 감동했어요 따뜻한 말 한마디와 맛있는 음식 덕분에 힘내서 갑니다	0
밥알이 말라비틀어져서 딱딱함 어제 팔다 남은 밥 섞어 파는 것 같음	0
맛있어요 ! 다음에도 방문할게요	1
김치전이 덜 익어서 반죽 맛이 그대로 남 밀가루 풋내 나서 못 먹겠음	0
선물해주려고 포장했는데 넘 맛있어 보여서 침이 꼴깍 넘어가더라구용! 사장님 엄청 친절하시구 먹는방법 설명도 잘 해주셔서 넘넘 좋았어용??	1
기대 안 했는데 고기 품질이 정말 좋네요! 야채도 신선하고 디저트로 과일이랑 아이스크림까지 있어서 완전 만족했어요.	1
아내가 임신 중에 샌드위치가 너무 먹고 싶대서 포장해갔는데 채소도 신선하고 소스가 진짜 맛있다고 감동하네요 ㅠㅠ	0
삼겹살이랑 닭고기까지 구워먹을 수 있어서 완전 맛있었어요!	1
파스타랑 피자, 리조또 다 맛있어요	1
진짜왕왕맛있고 가성비좋아요 짱입니당	1
여긴 최고에요 저는 이렇게 맛있는 집이 이 동네에 있다는게 넘 기분 좋고 좋아죽게떠요 알라뷰 용가	1
소스가 특별하고 맛있어요	1
개인냄비라는 게 위생적이라고 생각해요. 여럿이 한 냄비를 쓸 때보다 훨씬 마음이 놓이네요. 국물도 내가 원하는 맛으로 조절할 수 있고, 재료도 신선한 상태로 즐길 수 있어서 좋았습니다.	1
